{
  "schema_version": "1.0.0",
  "plan_id": "cmz-client-landing-action-request-semantic:artifacts",
  "input": {
    "kind": "semantic-model",
    "model_id": "cmz-client-landing-action-request-semantic",
    "sha256": "6b0d8f65a5d057f16096e49fca3a7791abb6e115d92e69c234b0de4d3d28713d"
  },
  "artifacts": [
    {
      "id": "package-descriptor",
      "responsibility": "package-descriptor",
      "owner": "generator-owned",
      "write_policy": "replace",
      "layer": "per-layer",
      "depends_on": []
    },
    {
      "id": "compiler-configuration",
      "responsibility": "compiler-configuration",
      "owner": "generator-owned",
      "write_policy": "replace",
      "layer": "per-layer",
      "depends_on": []
    },
    {
      "id": "domain-model",
      "responsibility": "domain-model",
      "owner": "generator-owned",
      "write_policy": "replace",
      "layer": "domain",
      "depends_on": []
    },
    {
      "id": "input-validator",
      "responsibility": "input-validator",
      "owner": "generator-owned",
      "write_policy": "replace",
      "layer": "domain",
      "depends_on": ["domain-model"]
    },
    {
      "id": "integration-client",
      "responsibility": "integration-client",
      "owner": "generator-owned",
      "write_policy": "replace",
      "layer": "data",
      "depends_on": ["domain-model"]
    },
    {
      "id": "extension-contract",
      "responsibility": "extension-contract",
      "owner": "generator-owned",
      "write_policy": "replace",
      "layer": "application",
      "depends_on": ["domain-model"]
    },
    {
      "id": "after-success-extension",
      "responsibility": "after-success-extension",
      "owner": "human-owned",
      "write_policy": "preserve",
      "layer": "application",
      "depends_on": ["extension-contract"]
    },
    {
      "id": "runtime-binding",
      "responsibility": "runtime-binding",
      "owner": "generator-owned",
      "write_policy": "replace",
      "layer": "application",
      "depends_on": [
        "domain-model",
        "integration-client",
        "extension-contract",
        "after-success-extension"
      ]
    },
    {
      "id": "public-api",
      "responsibility": "public-api",
      "owner": "generator-owned",
      "write_policy": "replace",
      "layer": "per-layer",
      "depends_on": [
        "domain-model",
        "input-validator",
        "integration-client",
        "extension-contract",
        "after-success-extension",
        "runtime-binding"
      ]
    }
  ]
}
